{
  "$schema": "https://json-schema.org/draft/2020-12/schema",
  "title": "Storyboard",
  "description": "故事 → 分镜 → 资产 → 关键帧 → 视频 的中间契约。核心设计：身份与造型分离 —— characters[] 是「谁」（脸，全片不变），identities[] 是「这一套造型」（服装，可多套）。镜头引用的是 identity，不是 character。",
  "type": "object",
  "required": [
    "meta",
    "story",
    "characters",
    "identities",
    "scenes",
    "shots"
  ],
  "additionalProperties": false,
  "properties": {
    "meta": {
      "type": "object",
      "required": [
        "title",
        "logline",
        "language",
        "aspect",
        "style",
        "total_duration_s",
        "stage",
        "approvals"
      ],
      "additionalProperties": false,
      "properties": {
        "title": {
          "type": "string",
          "minLength": 1
        },
        "project": {
          "type": "string",
          "pattern": "^[A-Za-z0-9._-]+$",
          "description": "剧目名：由外部项目工作区决定产出目录。一部剧一个独立目录，禁止写入源码仓库。"
        },
        "logline": {
          "type": "string",
          "minLength": 6
        },
        "genre": {
          "type": "string"
        },
        "language": {
          "type": "string",
          "minLength": 2
        },
        "aspect": {
          "enum": [
            "16:9",
            "9:16",
            "1:1"
          ]
        },
        "style": {
          "enum": [
            "realistic",
            "anime",
            "cartoon3d",
            "cyberpunk",
            "healing",
            "vintage"
          ]
        },
        "style_prompt": {
          "type": [
            "string",
            "null"
          ],
          "description": "风格圣经（散文）：统辖场景图和所有镜头的色调、光比、质感。**不作用于角色肖像和道具图** —— 那两张要中性可复用。"
        },
        "music": {
          "type": [
            "string",
            "null"
          ],
          "description": "画外配乐，写进 H3 的 non_diegetic_music 段；整片统一配乐才填"
        },
        "total_duration_s": {
          "type": "number",
          "minimum": 0,
          "maximum": 900
        },
        "final_video": {
          "type": [
            "string",
            "null"
          ]
        },
        "created_by": {
          "type": "string"
        },
        "created_at": {
          "type": "string",
          "pattern": "^\\d{4}-\\d{2}-\\d{2}T\\d{2}:\\d{2}:\\d{2}",
          "description": "项目创建时间（立项那一刻，ISO 8601）。由 cli/init-board.mjs 在生成板子时写入，之后**不再改动** —— 看板按它倒序排列剧目。缺失时看板退回 board.json 的 mtime 推断（老剧目迁移进仓库时目录时间会被抹平，只有文件 mtime 活着）。"
        },
        "stage": {
          "enum": [
            "story",
            "shots",
            "assets",
            "keyframes",
            "rendering",
            "done"
          ],
          "description": "当前停在哪个闸门：story=确认故事，shots=确认分镜表，assets=确认资产（肖像/身份图/场景/道具），keyframes=确认关键帧，rendering=可以出片，done=成片已合成"
        },
        "approvals": {
          "type": "object",
          "required": [
            "story",
            "shots",
            "assets",
            "keyframes"
          ],
          "additionalProperties": false,
          "properties": {
            "story": {
              "type": [
                "object",
                "null"
              ],
              "additionalProperties": false,
              "properties": {
                "at": {
                  "type": "string"
                },
                "by": {
                  "type": "string"
                }
              }
            },
            "shots": {
              "type": [
                "object",
                "null"
              ],
              "additionalProperties": false,
              "properties": {
                "at": {
                  "type": "string"
                },
                "by": {
                  "type": "string"
                }
              }
            },
            "assets": {
              "type": [
                "object",
                "null"
              ],
              "additionalProperties": false,
              "properties": {
                "at": {
                  "type": "string"
                },
                "by": {
                  "type": "string"
                }
              }
            },
            "keyframes": {
              "type": [
                "object",
                "null"
              ],
              "additionalProperties": false,
              "properties": {
                "at": {
                  "type": "string"
                },
                "by": {
                  "type": "string"
                }
              }
            }
          }
        }
      }
    },
    "story": {
      "type": "object",
      "description": "闸门 1 的产物：给人读的故事。",
      "required": [
        "synopsis",
        "beats"
      ],
      "additionalProperties": false,
      "properties": {
        "source": {
          "type": [
            "string",
            "null"
          ],
          "description": "原始素材原文（剧本/小说）。有它时编译分镜必须原样沿用里面的台词，一个字都不许改。"
        },
        "synopsis": {
          "type": "string",
          "minLength": 20
        },
        "beats": {
          "type": "array",
          "minItems": 2,
          "description": "故事节拍。每条必须带 purpose（为什么存在）—— 它决定后面用什么镜头语言去拍，没有 purpose 的节拍只能配出一张插图。",
          "items": {
            "type": "object",
            "required": [
              "text",
              "purpose"
            ],
            "additionalProperties": false,
            "properties": {
              "text": {
                "type": "string",
                "minLength": 4,
                "description": "发生了什么"
              },
              "purpose": {
                "type": "string",
                "minLength": 4,
                "description": "为什么这一拍必须在片子里：推进剧情 / 建立人物 / 制造笑点 / 情绪落点 / 交代信息"
              },
              "emotion": {
                "type": "string",
                "description": "这一拍的情绪走向"
              }
            }
          }
        },
        "tone": {
          "type": "string"
        },
        "ending": {
          "type": "string"
        }
      }
    },
    "characters": {
      "type": "array",
      "description": "**身份层**：一个角色在本片里只有一张脸。服装不在这里 —— 那是 identities[] 的事。",
      "items": {
        "type": "object",
        "required": [
          "id",
          "name",
          "age_group",
          "face_prompt"
        ],
        "additionalProperties": false,
        "properties": {
          "id": {
            "type": "string",
            "pattern": "^[a-z][a-z0-9_]*$"
          },
          "name": {
            "type": "string",
            "minLength": 1
          },
          "species": {
            "type": "string",
            "description": "角色物种。缺省（或 human）= 人类：肖像会带族裔锚点、人类年龄档和「素色上衣」条款。非 human（cat/dog/mouse…）时**这三项全部跳过**，改用毛发/体表描述 —— 否则「东亚人，中国人」和「只穿素色上衣」会被注入到一只猫的提示词里，诱导模型把它画成拟人化或穿衣服的角色。非人类角色仍保留 age_group 字段，但不再进提示词。🔁 **已复发（第 2 次记录，最近：mimi_bone 2026-09-19）**：写立项 Brief 时漏填 species，于是一条柴犬的肖像提示词里被注入「东亚人，中国人」与「只穿素色无花纹的上衣 / 画面下边界必须切在锁骨上方」，身份图里被注入「四格人物高度一致 / 五官、发型、领口」。**缺省不是「未知」，而是「人类」** —— 非人类卡司必须显式写 species，且它是立项 Brief 的必填项，不是可选项。**另有一档「直立拟人」**：species 里带 `anthropomorphic`（形如 `fox_anthropomorphic` / `gopher_anthropomorphic`）= 这只非人类角色是**直立的拟人形态**（两条腿站立、有可抓握的双手），资产配方会跳过「四足动物／不直立／不拟人化／不穿衣」那一段，改用直立拟人的体表条款。三档互斥：human / 四足（非 human 且不含 anthropomorphic）/ 拟人。🔁 **已复发（第 2 次记录，最近：gopher_toll → half_step 2026-09-21）**：拟人动物（直立的地鼠劫匪、直立跳舞的小狐狸）在只有四足配方时，**身份锚会与每一条关键帧提示词互相矛盾**（gopher_toll 实测只能靠手工写的资产提示词绕开）。判据见 `src/assets.mjs` 的 `isAnthropomorphic()`。"
          },
          "age_group": {
            "enum": [
              "child",
              "youth",
              "middle",
              "elder"
            ],
            "description": "受控枚举，不是自由文本。含糊的年龄（「少女」「青年」）会被原样拼进提示词，等于把年龄交给模型抽签 —— 实测因此把成年角色画成幼儿园小孩。**非人类角色（species ≠ human）不进提示词。**"
          },
          "face_prompt": {
            "type": "string",
            "minLength": 6,
            "description": "**纯面部特征**：脸型、五官、发型、辨识特征（痣/疤）。禁止写服装、禁止写动作表情。这张脸喂给肖像生成，之后全片复用。"
          },
          "portrait": {
            "type": [
              "string",
              "null"
            ],
            "description": "脸部锚点图：正面朝向、脸占画面 60-70%、纯灰底、素色上衣、禁服装细节。它是所有身份图的输入。"
          },
          "voice": {
            "type": "string",
            "description": "音色描述，供 TTS 复用"
          },
          "identities": {
            "type": "array",
            "items": {
              "type": "string"
            },
            "description": "这个角色拥有的造型 id 列表，必须与 identities[] 双向一致"
          }
        }
      }
    },
    "identities": {
      "type": "array",
      "description": "**造型层**：一个角色可以有多个身份（「战神时期」「皇后宫装」「皇后便装」）。镜头引用的是这一层。",
      "items": {
        "type": "object",
        "required": [
          "id",
          "character",
          "name",
          "appearance_details"
        ],
        "additionalProperties": false,
        "properties": {
          "id": {
            "type": "string",
            "pattern": "^[a-z][a-z0-9_]*$",
            "description": "约定形如 <角色id>_<形态>，如 xie_zhong_emperor"
          },
          "character": {
            "type": "string",
            "description": "引用 characters[].id"
          },
          "name": {
            "type": "string",
            "minLength": 1,
            "description": "给人看的形态名，如「宫中常服」"
          },
          "appearance_details": {
            "type": "string",
            "minLength": 6,
            "description": "**服装、配饰、发型造型**（不含动作和表情）。这一层才允许写衣服。"
          },
          "costume_image": {
            "type": [
              "string",
              "null"
            ],
            "description": "服装参考图。生成身份图时，**脸取自 portrait，衣取自这一张** —— 服装参考优先于文字。"
          },
          "sheet": {
            "type": [
              "string",
              "null"
            ],
            "description": "身份图：一次生成的 4 面板参考表（脸部特写 / 正面全身 / 约45°三分 / 背面）。镜头拿它锁身份。"
          },
          "reference_images": {
            "type": "array",
            "items": {
              "type": "string"
            }
          },
          "voice_ref": {
            "type": [
              "string",
              "null"
            ],
            "description": "身份级参考音频。同一角色不同形态可以不同声线。"
          }
        }
      }
    },
    "scenes": {
      "type": "array",
      "items": {
        "type": "object",
        "required": [
          "id",
          "name",
          "environment"
        ],
        "additionalProperties": false,
        "properties": {
          "id": {
            "type": "string",
            "pattern": "^[a-z][a-z0-9_]*$"
          },
          "name": {
            "type": "string",
            "minLength": 1
          },
          "environment": {
            "type": "string",
            "minLength": 6,
            "description": "同景镜头逐字一致，保证背景连贯"
          },
          "time_of_day": {
            "enum": [
              "无",
              "清晨",
              "上午",
              "正午",
              "午后",
              "白天",
              "黄昏",
              "夜晚"
            ],
            "description": "受控词表（别名如卯时→清晨、亥时→夜晚在解析时归一）"
          },
          "scene_no": {
            "type": [
              "integer",
              "null"
            ],
            "description": "剧本里的场次号（1-2 里的 2），由场次正则解析得来。用来把 board.scenes 和剧本原文对上。"
          },
          "master": {
            "type": [
              "string",
              "null"
            ],
            "description": "正面环境图（160-180°）。**禁人、禁临时道具** —— 它是这个场景的风格锚。"
          },
          "reverse_master": {
            "type": [
              "string",
              "null"
            ],
            "description": "反向 180° 环境图。左右边缘必须与 master 的侧墙可缝合。"
          },
          "spatial_layout": {
            "type": [
              "string",
              "null"
            ],
            "description": "俯视平面图，锁定空间结构"
          }
        }
      }
    },
    "props": {
      "type": "array",
      "description": "道具资产：跨镜头出现的小物件。不做它的话，同一把剑在不同镜头里长得不一样。",
      "items": {
        "type": "object",
        "required": [
          "id",
          "name",
          "description"
        ],
        "additionalProperties": false,
        "properties": {
          "id": {
            "type": "string",
            "pattern": "^[a-z][a-z0-9_]*$"
          },
          "name": {
            "type": "string",
            "minLength": 1
          },
          "description": {
            "type": "string",
            "minLength": 4
          },
          "owner": {
            "type": [
              "string",
              "null"
            ],
            "description": "属于哪个角色（可选）"
          },
          "ref_image": {
            "type": [
              "string",
              "null"
            ],
            "description": "三视图（正/侧/背），产品摄影白底，无手无人，禁止可读文字"
          }
        }
      }
    },
    "shots": {
      "type": "array",
      "items": {
        "type": "object",
        "required": [
          "id",
          "scene",
          "cast",
          "duration_s",
          "shot_size",
          "lighting",
          "camera",
          "action",
          "prompt",
          "audio",
          "dialogue",
          "edit_note",
          "transition"
        ],
        "additionalProperties": false,
        "properties": {
          "id": {
            "type": "string",
            "pattern": "^s[0-9]{2,}$"
          },
          "scene": {
            "type": "string",
            "description": "引用 scenes[].id"
          },
          "cast": {
            "type": "array",
            "items": {
              "type": "string"
            },
            "description": "**出场身份**（引用 identities[].id，不是 characters[].id）。空数组必须是真的没人 —— 「还没填」和「没人」不许混为一谈。"
          },
          "props": {
            "type": "array",
            "items": {
              "type": "string"
            },
            "description": "本镜出场道具，引用 props[].id"
          },
          "source_lines": {
            "type": "array",
            "items": {
              "type": "integer"
            },
            "description": "这一镜是从剧本原文的哪几行来的（1-based 行号）。逐行模式专用：**每一句台词落在哪一镜必须可查**，否则「没丢台词」就只能靠人肉眼比对。"
          },
          "duration_s": {
            "type": "number",
            "minimum": 1,
            "maximum": 15
          },
          "shot_size": {
            "enum": [
              "远景",
              "全景",
              "中景",
              "近景",
              "特写"
            ]
          },
          "lighting": {
            "type": "string",
            "minLength": 2
          },
          "camera": {
            "type": "string",
            "minLength": 2,
            "description": "运镜，写动词不写形容词：缓慢前推 / 环绕 / 低角度仰拍 / 手持跟随"
          },
          "action": {
            "type": "string",
            "minLength": 4
          },
          "prompt": {
            "type": "string",
            "minLength": 12,
            "description": "画面提示词。出场人物必须以 {{identity_id}} 标记内联，道具用 [[prop_id]]。禁止「或者」「二选一」—— 含糊的画面没法渲染。"
          },
          "audio": {
            "type": "string",
            "description": "环境音/音效。必须是听得见的具体事件 —— H3 的输出电平跟着内容走：写「轻微的环境音」得到 -74 dB（等于静音），写「篮球重拍木地板」得到 -20 dB。"
          },
          "dialogue": {
            "type": "array",
            "items": {
              "type": "object",
              "required": [
                "character",
                "text"
              ],
              "additionalProperties": false,
              "properties": {
                "character": {
                  "type": "string",
                  "description": "引用 identities[].id"
                },
                "text": {
                  "type": "string",
                  "minLength": 1
                },
                "emotion": {
                  "type": "string"
                },
                "kind": {
                  "enum": [
                    "spoken",
                    "voiceover"
                  ],
                  "description": "spoken=画内开口；voiceover=内心独白/旁白（OS）"
                },
                "audio": {
                  "type": [
                    "string",
                    "null"
                  ],
                  "description": "这句台词的配音文件。**先出配音、量出秒数、再定画面时长** —— 反过来做必然对不齐。"
                }
              }
            }
          },
          "edit_note": {
            "type": "string"
          },
          "transition": {
            "type": "object",
            "required": [
              "type"
            ],
            "additionalProperties": false,
            "properties": {
              "type": {
                "enum": [
                  "cut",
                  "last_frame_first",
                  "dissolve"
                ]
              },
              "note": {
                "type": "string"
              }
            }
          },
          "first_frame": {
            "type": [
              "string",
              "null"
            ]
          },
          "last_frame": {
            "type": [
              "string",
              "null"
            ]
          },
          "clip": {
            "type": [
              "string",
              "null"
            ]
          }
        }
      }
    }
  }
}
