{
  "meta": {
    "title": "醒来之后",
    "logline": "十九岁男孩一早醒来发现变成了女孩，崩溃一场后醒来，庆幸只是梦——直到他抓了抓自己的头发",
    "genre": "奇幻喜剧 / 嵌套反转",
    "language": "zh-CN",
    "aspect": "9:16",
    "style": "cartoon3d",
    "style_prompt": "精致 3D 卡通渲染，皮克斯与迪士尼动画长片质感，明亮通透，柔和体积光与柔和阴影，中高饱和，细腻材质表现，浅景深，清晨偏冷的暖调环境光",
    "total_duration_s": 30,
    "created_by": "用户",
    "stage": "shots",
    "approvals": {
      "story": {
        "at": "2026-09-17T14:08:21Z",
        "by": "用户"
      },
      "shots": {
        "at": "2026-09-17T14:18:08Z",
        "by": "用户"
      },
      "assets": null,
      "keyframes": null
    },
    "music": null,
    "project": "after_waking"
  },
  "story": {
    "synopsis": "十九岁的陈屿在清晨的闹钟声里醒来，觉得被子下的自己不太对劲。他掀开被子，看见一双白净细长、没有茧的手；摸脸、抓头发、试着出声，垂到胸口的及腰长发和发抖的女声都在告诉他：他变成了女孩。他连滚带爬到穿衣镜前，镜中是一个穿浅粉睡裙的长发女孩，跟着他抬手、歪头，同步得分毫不差。他崩溃抱头蹲下。下一秒，闹钟再次响起——他猛地睁眼，还是那间卧室、那床被子、那双有薄茧的手。他长舒一口气，笑着倒回枕头。然后他顺手抓了抓头发，指缝间滑过一把及腰的长发。",
    "tone": "快节奏、反应夸张的奇幻喜剧；笑点全部落在「反应」而不是「身体」上，结尾用一次骤停收束",
    "ending": "他以为梦醒了，随手抓头发却抓出一把及腰长发，笑容僵在脸上，画面黑",
    "beats": [
      {
        "text": "清晨，陈屿在闹钟声里醒来，伸手按掉手机，发现那只手白净细长、指节上没有他熟悉的茧",
        "purpose": "建立日常，并把第一个异常信号交给观众——不解释，只呈现",
        "emotion": "困倦 → 困惑"
      },
      {
        "text": "他猛地坐起，翻看自己的手，摸脸，又抓住垂到胸口的及腰长发举到眼前",
        "purpose": "把「变成了女孩」从抽象概念落实成三个具体动作，笑点建立在这段自我检查上",
        "emotion": "错愕 → 惊慌"
      },
      {
        "text": "他冲到穿衣镜前，镜中是一个穿浅粉睡裙的长发女孩正瞪大眼睛；他抬手、歪头，镜中人分毫不差地同步",
        "purpose": "全片唯一的视觉冲击点与全身镜反应镜，笑点落在表情的同步，不落在身体",
        "emotion": "惊恐"
      },
      {
        "text": "陈屿崩溃抱头蹲下，双肩一抽一抽地抖",
        "purpose": "情绪最高点，为紧接着的反转留出落差",
        "emotion": "绝望"
      },
      {
        "text": "枕边闹钟再次响起，他猛地睁眼坐起：还是那间卧室、那床被子、那双有薄茧的手",
        "purpose": "反转——原来是梦；用他最熟悉的细节反证「这次真的是自己」",
        "emotion": "惊魂未定 → 释然"
      },
      {
        "text": "他大口喘着气笑出来，仰面倒回枕头，长出一口气",
        "purpose": "让观众和角色一起放松，为最后一拍做铺垫",
        "emotion": "放松"
      },
      {
        "text": "他顺手抓了抓头发，指缝间滑过一把及腰的长发，发尾散在枕头上，笑容僵在脸上，画面黑",
        "purpose": "二次反转与收尾笑点，把「醒过来」这件事本身变成新的悬念",
        "emotion": "骤停的僵硬"
      }
    ],
    "source": "短剧剧本：醒来之后\n\n风格：精致 3D 卡通，皮克斯与迪士尼动画质感，明亮通透，柔和体积光，中高饱和\n时长：约 30 秒\n\n人物设定\n陈屿：十九岁亚洲男生，圆脸，眉眼干净，右眉尾一颗小痣；常态是深蓝色棉质睡衣与短寸头，梦里那身则是浅粉色棉质睡裙与垂到腰际的黑色长直发；性格毛躁，遇到想不通的事第一反应是喊出来。\n\n第 1 集 1-1 场景：内 陈屿卧室 清晨 人物：陈屿\n\n△ 清晨，卧室窗帘半掩，一道斜光落在被子上，床头柜上的手机屏幕亮起。\n△ 枕边的手机震动，一只手从被子里伸出来，摸到手机，按掉，屋里重新安静。\n△ 特写：那只手白净、细长，指甲修得整齐，指节上没有他熟悉的茧。\n△ 陈屿在被子里翻了个身，手停在半空，眉头皱起。\n陈屿（半睡半醒，声音发飘）：……什么情况。\n\n△ 陈屿猛地坐起，被子滑到腰上，他低头盯着自己的手，翻过来又翻过去。\n△ 他抬手摸自己的脸，指尖划过下颌，动作停住。\n△ 他抓住垂到胸口的一把长发，慢慢举到眼前，瞳孔一缩。\n陈屿（急促，音量拔高）：不是吧——\n\n△ 陈屿连滚带爬冲到穿衣镜前，双手撑住镜面，胸口起伏。\n△ 镜子里是一个长发女孩，穿着浅粉色棉质睡裙，圆脸，右眉尾一颗小痣，正瞪大眼睛看他。\n陈屿（盯着镜子，声音发抖）：这谁啊？\n△ 他抬手摸左脸，镜中女孩同步摸左脸；他歪头，镜中女孩同步歪头。\n陈屿（崩溃，抱头蹲下）：不行不行不行——\n\n△ 他蹲在穿衣镜前，双肩一抽一抽地抖。\n△ 枕边的手机闹钟再次响起，铃声刺破安静。\n△ 陈屿猛地睁眼，直直坐起，还是那间卧室，还是那道斜光，被子还是那床被子。\n△ 他低头看自己的手，骨节分明，指腹有薄茧。\n陈屿（大口喘气，笑出来）：……吓死我了。\n△ 他仰面倒回枕头，长出一口气，伸手抓了抓自己的头发。\n△ 特写：指缝间滑过一把及腰的长发，发尾散在枕头上。\n△ 陈屿的笑容僵在脸上，眼睛慢慢睁大。画面黑。\n\n片尾字幕：醒来之后\n"
  },
  "characters": [
    {
      "id": "chen_yu",
      "name": "陈屿",
      "age_group": "youth",
      "face_prompt": "十九岁东亚面孔，圆脸偏鹅蛋形，眉眼干净，双眼皮，鼻梁挺直，唇形偏薄，右眉尾一颗小痣",
      "portrait": "assets/chen_yu_portrait.png",
      "voice": "十九岁男声，清亮，语速偏快，情绪上来会拔高",
      "identities": [
        "chen_yu_dream_girl",
        "chen_yu_wake_boy",
        "chen_yu_wake_boy_long"
      ]
    }
  ],
  "identities": [
    {
      "id": "chen_yu_dream_girl",
      "character": "chen_yu",
      "name": "梦中女装",
      "appearance_details": "浅粉色棉质睡裙，裙长过膝，无花纹，短袖；黑色长直发垂到腰际，发梢自然微卷；赤脚",
      "costume_image": null,
      "sheet": "assets/chen_yu_dream_girl_sheet.png",
      "reference_images": [],
      "voice_ref": null
    },
    {
      "id": "chen_yu_wake_boy",
      "character": "chen_yu",
      "name": "梦醒男装",
      "appearance_details": "深蓝色棉质睡衣套装，长袖上衣配同色长裤，无花纹；黑色短寸头，发梢略翘；赤脚",
      "costume_image": null,
      "sheet": "assets/chen_yu_wake_boy_sheet.png",
      "reference_images": [],
      "voice_ref": null
    },
    {
      "id": "chen_yu_wake_boy_long",
      "character": "chen_yu",
      "name": "梦醒长发",
      "appearance_details": "同一身深蓝色棉质睡衣套装，长袖上衣配同色长裤，无花纹；头发是及腰的黑色长直发，发梢自然微卷；赤脚",
      "costume_image": null,
      "sheet": "assets/chen_yu_wake_boy_long_sheet.png",
      "reference_images": [],
      "voice_ref": null
    }
  ],
  "scenes": [
    {
      "id": "scene_01",
      "name": "陈屿卧室",
      "environment": "陈屿卧室，清晨，卧室窗帘半掩，一道斜光落在被子上；床、床头柜与窗帘陈设简单，房间角落立着一面浅木色细边框的落地穿衣镜",
      "time_of_day": "清晨",
      "scene_no": 1,
      "master": "assets/scene_01_master.png",
      "reverse_master": null,
      "spatial_layout": null
    }
  ],
  "props": [
    {
      "id": "phone",
      "name": "手机",
      "description": "深色直板智能手机，深灰金属边框，屏幕亮起时是白色闹钟界面",
      "owner": "chen_yu",
      "ref_image": "assets/phone_ref_image.png"
    },
    {
      "id": "mirror",
      "name": "穿衣镜",
      "description": "落地穿衣镜，浅木色细边框，椭圆形镜面，立在卧室角落，镜面干净无贴纸",
      "owner": "chen_yu",
      "ref_image": "assets/mirror_ref_image.png"
    }
  ],
  "shots": [
    {
      "id": "s01",
      "scene": "scene_01",
      "cast": [
        "chen_yu_dream_girl"
      ],
      "props": [],
      "source_lines": [
        15,
        20
      ],
      "duration_s": 10.5,
      "shot_size": "近景",
      "lighting": "清晨斜光落在被面上，手机屏幕的冷白光映在手背上",
      "camera": "缓慢前推",
      "action": "0 秒时画面只有被面、枕角和一部刚亮起并开始震动的手机：一只手刚从被子边缘伸出来，指尖接近手机但还没有碰到，手背朝上，五指半张。；随后 一只白净细长的手从被子里伸出来，摸到枕边震动的手机，按下去，屋里重新安静，手停在手机上不动 → 陈屿在被子里翻了个身，一只手僵在半空停住，眉头向内收拢，嘴唇动了两下开口说话 → 陈屿坐在床上，被子堆在腰际，低头盯着自己的手，把手翻过来又翻过去，指尖一根根张开 → 她抓起垂到胸口的一把及腰长发，慢慢举到眼前，手臂僵在半空，瞳孔一缩，嘴唇张开",
      "prompt": "{{chen_yu_dream_girl}}，一只白净细长的手从被子里伸出来，摸到枕边震动的手机，按下去，屋里重新安静，手停在手机上不动，近景，缓慢前推",
      "audio": "手机在枕边震动，被料摩擦的沙沙声，随后归于安静；被料翻动之后的静场，只有很轻的呼吸声；床垫受压的轻响，被子滑落的摩擦声；头发从睡衣肩头滑过的细碎摩擦声",
      "dialogue": [
        {
          "character": "chen_yu_dream_girl",
          "text": "……什么情况。",
          "emotion": "半睡半醒，声音发飘",
          "kind": "spoken"
        },
        {
          "character": "chen_yu_dream_girl",
          "text": "不是吧——",
          "emotion": "急促，音量拔高",
          "kind": "spoken"
        }
      ],
      "edit_note": "导演单元 u1（4 镜：0.0s 近景 / 3.0s 近景 / 6.0s 中景 / 9.0s 特写）",
      "transition": {
        "type": "cut"
      },
      "first_frame": null,
      "last_frame": null,
      "clip": null
    },
    {
      "id": "s02",
      "scene": "scene_01",
      "cast": [
        "chen_yu_dream_girl"
      ],
      "props": [],
      "source_lines": [
        24,
        26
      ],
      "duration_s": 10.5,
      "shot_size": "中景",
      "lighting": "清晨斜光从侧后方打来，镜面上有一道细长的高光",
      "camera": "固定",
      "action": "0 秒时陈屿已经站在穿衣镜前，双手撑在镜面两侧的边框上，肩膀抬起，胸口起伏，镜面里同时映出一个穿浅粉睡裙、及腰长发的女孩。；随后 陈屿双手撑在穿衣镜两侧，胸口起伏，眼睛盯着镜面里的那个人，肩膀一点点抬起来 → 镜面里的女孩睁大眼睛与镜外的人对视，鼻尖几乎贴上玻璃，嘴唇动了两下开口说话 → 她抬起右手摸自己的左脸，镜面里的女孩几乎同时抬起同一只手摸左脸；她歪头，倒影也跟着歪头，两边动作分毫不差 → 她双手抱住头，慢慢蹲下去，双肩向内缩起，镜面里的女孩也跟着矮下去，最后只剩上半身映在镜子里",
      "prompt": "{{chen_yu_dream_girl}}，陈屿双手撑在穿衣镜两侧，胸口起伏，眼睛盯着镜面里的那个人，肩膀一点点抬起来，中景，固定",
      "audio": "急促的呼吸声，房间里很安静；呼吸声贴得很近，玻璃上有一点极轻的气流声；指尖擦过脸颊的轻响，衣料摩擦声；布料摩擦地面的声音，压低的呼吸声",
      "dialogue": [
        {
          "character": "chen_yu_dream_girl",
          "text": "这谁啊？",
          "emotion": "盯着镜子，声音发抖",
          "kind": "spoken"
        },
        {
          "character": "chen_yu_dream_girl",
          "text": "不行不行不行——",
          "emotion": "崩溃，抱头蹲下",
          "kind": "spoken"
        }
      ],
      "edit_note": "导演单元 u2（4 镜：0.0s 中景 / 2.5s 近景 / 5.5s 中景 / 8.0s 近景）",
      "transition": {
        "type": "cut"
      },
      "first_frame": null,
      "last_frame": null,
      "clip": null
    },
    {
      "id": "s03",
      "scene": "scene_01",
      "cast": [
        "chen_yu_wake_boy",
        "chen_yu_dream_girl"
      ],
      "props": [],
      "source_lines": [
        32
      ],
      "duration_s": 5.5,
      "shot_size": "中景",
      "lighting": "同一道清晨斜光落在被子上，和第一段完全一致",
      "camera": "固定",
      "action": "0 秒时陈屿闭着眼睛仰躺在枕头上，被子盖到胸口，枕边的手机屏幕刚亮起并开始震动，头发是黑色短寸头。；随后 枕边的手机闹钟响起，陈屿闭着眼皱了一下眉，随即睁开眼睛，上身猛地抬起来坐直，被子滑到腰间 → 陈屿低头看自己的双手，骨节分明，指腹上有薄茧，他大口喘着气，肩膀松下来，笑出了声",
      "prompt": "{{chen_yu_wake_boy}}、{{chen_yu_dream_girl}}，枕边的手机闹钟响起，陈屿闭着眼皱了一下眉，随即睁开眼睛，上身猛地抬起来坐直，被子滑到腰间，中景，固定",
      "audio": "手机闹钟铃声刺破安静，被子弹开的摩擦声；大口喘气的声音，随后一声放松的呼气",
      "dialogue": [
        {
          "character": "chen_yu_dream_girl",
          "text": "……吓死我了。",
          "emotion": "大口喘气，笑出来",
          "kind": "spoken"
        }
      ],
      "edit_note": "导演单元 u3（2 镜：0.0s 中景 / 2.5s 近景）",
      "transition": {
        "type": "cut"
      },
      "first_frame": null,
      "last_frame": null,
      "clip": null
    },
    {
      "id": "s04",
      "scene": "scene_01",
      "cast": [
        "chen_yu_wake_boy_long"
      ],
      "props": [],
      "source_lines": [],
      "duration_s": 5,
      "shot_size": "中景",
      "lighting": "清晨斜光照在枕头上，头发在枕面上铺开",
      "camera": "固定",
      "action": "0 秒时陈屿坐在床上，肩膀完全放松，上身正向枕头方向倒下，一只手已经抬到耳侧，头发是及腰的黑色长直发，散在肩后。；随后 陈屿仰面倒回枕头，长出一口气，抬手伸向自己头顶，手指插进头发里 → 特写他的手指和头发：指缝间滑过一把及腰的长发，发尾散在枕头上；他的笑容停在脸上不动，眼睛慢慢睁大，画面转黑",
      "prompt": "{{chen_yu_wake_boy_long}}，陈屿仰面倒回枕头，长出一口气，抬手伸向自己头顶，手指插进头发里，中景，固定",
      "audio": "身体压进枕头的闷响，一声长长的呼气；头发从指间滑过的细响，随后所有声音一起压低",
      "dialogue": [],
      "edit_note": "导演单元 u4（2 镜：0.0s 中景 / 2.5s 特写）",
      "transition": {
        "type": "cut"
      },
      "first_frame": null,
      "last_frame": null,
      "clip": null
    }
  ]
}
